{
  "$schema": "./schema/config.schema.json",
  "audit": {
    "dispositions": [
      {
        "path": "tests/audit.test.js",
        "reason": "This non-production module embeds multi-language artifact, command, and schema fixtures but owns no runtime navigation responsibility."
      }
    ]
  },
  "coverageRules": [
    {
      "match": ["src/mcp-refresh.js"],
      "name": "MCP source freshness",
      "requiredFields": ["owns", "invariant"],
      "scope": "module"
    },
    {
      "match": ["src/read-operation.js"],
      "name": "idempotent read resilience",
      "requiredFields": ["owns", "invariant"],
      "scope": "module"
    },
    {
      "match": [
        "src/config.js"
      ],
      "name": "repository configuration contract",
      "requiredFields": [
        "owns",
        "invariant"
      ],
      "scope": "module"
    },
    {
      "match": [
        "src/declaration.js",
        "src/doctor.js",
        "src/files.js",
        "src/formatter.js",
        "src/migration.js",
        "src/project.js",
        "src/registry.js",
        "src/spec.js"
      ],
      "name": "core public module boundaries",
      "requiredFields": [
        "owns",
        "invariant"
      ],
      "scope": "module"
    },
    {
      "match": [
        "src/audit.js"
      ],
      "name": "annotation coverage audit",
      "requiredFields": [
        "owns",
        "invariant"
      ],
      "scope": "module"
    },
    {
      "match": [
        "benchmarks/conformance.js"
      ],
      "name": "cross-repository conformance evaluation",
      "requiredFields": [
        "owns",
        "invariant"
      ],
      "scope": "module"
    },
    {
      "match": [
        "examples/provider-neutral-host.mjs"
      ],
      "name": "provider-neutral host boundary",
      "requiredFields": [
        "owns",
        "invariant"
      ],
      "scope": "module"
    }
  ],
  "evaluation": {
    "minimumRecallAt1": 0.75,
    "minimumRecallAt5": 0.9,
    "queryFile": ".llmnav/eval/queries.jsonl"
  },
  "excludeDirectories": [
    ".git",
    ".hg",
    ".svn",
    ".idea",
    ".vscode",
    "node_modules",
    "vendor",
    "dist",
    "build",
    "coverage",
    ".next",
    ".nuxt",
    ".svelte-kit",
    ".astro",
    ".turbo",
    ".cache",
    "target",
    "bin",
    "obj"
  ],
  "excludeFiles": [
    "*.min.js",
    "*.bundle.js",
    "*.generated.*",
    "*.gen.*"
  ],
  "generation": {
    "cacheDirectory": ".llmnav/cache",
    "moduleCatalogStabilities": [
      "architecture",
      "contract"
    ],
    "moduleDepth": 2,
    "repositoryCatalogStabilities": [
      "architecture"
    ]
  },
  "includeExtensions": [
    ".ts",
    ".tsx",
    ".js",
    ".jsx",
    ".mjs",
    ".cjs",
    ".go",
    ".rs",
    ".py",
    ".java",
    ".kt",
    ".kts",
    ".c",
    ".cc",
    ".cpp",
    ".h",
    ".hpp",
    ".cs",
    ".swift",
    ".dart",
    ".php",
    ".rb",
    ".sh",
    ".bash",
    ".zsh",
    ".sql",
    ".svelte",
    ".astro",
    ".vue"
  ],
  "lint": {
    "additionalEffects": [],
    "additionalRelations": [],
    "additionalRisks": [],
    "genericSearchTerms": [
      "service",
      "manager",
      "handler",
      "helper",
      "utility",
      "util",
      "data",
      "process",
      "logic",
      "common",
      "shared"
    ],
    "maxBlockBytes": {
      "file": 400,
      "module": 1200,
      "symbol": 900
    },
    "maxEffects": 6,
    "maxInvariants": 4,
    "maxRelations": 6,
    "maxRoleLength": 180,
    "maxSearchTerms": 6,
    "maxSemanticRatio": 0.05,
    "minimumCardsForSaturation": 20,
    "minimumSourceBytesForRatio": 50000,
    "minSearchTerms": 2,
    "requireCanonicalFormatting": true,
    "requireCanonicalOrder": true,
    "searchTermSaturation": 0.05,
    "strictRisks": [
      "auth",
      "money",
      "privacy"
    ],
    "vagueRoleWords": [
      "handle",
      "handles",
      "manage",
      "manages",
      "process",
      "processes",
      "utility",
      "helper",
      "service"
    ]
  },
  "repositoryId": "llmnav",
  "sourceRoots": [
    "."
  ],
  "version": 1
}
